{
  "schema": "cargo-allow.relocated-package-docs.v1",
  "basis": {
    "exact_candidate_receipt_digest": "298c1882d1baf1baed56f031cae546b05fe66e4ba732f7b7e91c47b4cd944d91",
    "packaged_surface_digest": "b6059a9fa890656a045f6510e0ab8c41c944f9c96e73b093402ab98dbca8918b",
    "git_head": "0264310fc8d41216b4ae2882bbdb736e33ce76bd",
    "toolchain": "cargo 1.98.1 (797e8a9bc 2026-08-05)",
    "network_posture": "fetch_warm_may_use_crates_io",
    "isolation": "local_registry_offline"
  },
  "rows": [
    {
      "name": "allow-core",
      "version": "0.2.0",
      "crate_sha256": "c08fc976f3433e9f22568d519205003be34ca7b45cf6b9a07fbe80a53c426bf4",
      "crate_size_bytes": 52151,
      "manifest_digest": "ee47df24ffe4e5e0127ea196e7d8d28a74a578f9a06ce3b15098b636905f72ee",
      "file_list_digest": "1c8ff0c343bd8072c83dac8515583c766a9163def6662cb5a2effb0240a59bdb",
      "readme_present": true,
      "readme_sha256": "ea7fdcf09bceff67ed6ae111e25037c5224e7904e4f29372da190600f0ab1478",
      "license_assets_present": true,
      "external_repo_refs": [
        "docs/claim-boundaries.md"
      ],
      "reference_projection": {
        "published_version": "0.1.11",
        "candidate_version": "0.2.0",
        "channel_digest": "cb737ba63d2eed51113e8d4f056611a5fa50e1f5f68cf22475e94c4caef5e99a"
      },
      "check_exit": 0,
      "check_warnings": 0,
      "doc_exit": 0,
      "doc_warnings": 0,
      "doc_posture": "clean",
      "doctest_exit": 0,
      "doctests_passed": 0,
      "doctest_posture": "no_public_doctests",
      "examples_posture": "NoExampleSelected",
      "examples_exit": null,
      "features": [],
      "features_posture": "no_features",
      "no_default_check_exit": null,
      "role_marker": "Core data model",
      "limitation_marker": "It does not scan source files",
      "sibling_products_separate": true,
      "result": "complete",
      "limitations": []
    },
    {
      "name": "allow-policy",
      "version": "0.2.0",
      "crate_sha256": "92076a2763cd39ba79834033e59c355c0706dcca2f5f414a87d2db772bb0a775",
      "crate_size_bytes": 205787,
      "manifest_digest": "b90f98f67e7309bd4926fa64a7c6fb8f8c9360084e261a43ef5243c1582a1749",
      "file_list_digest": "d463d5d246b979d8f7a94baccfe8b1e31dd8463976a256e9497ae3263a5fe82b",
      "readme_present": true,
      "readme_sha256": "a2adfd8e4a7851b89f56ccaa1dccea85c8c96172c651ed11be46941bde42cd36",
      "license_assets_present": true,
      "external_repo_refs": [
        "docs/claim-boundaries.md"
      ],
      "reference_projection": {
        "published_version": "0.1.11",
        "candidate_version": "0.2.0",
        "channel_digest": "cb737ba63d2eed51113e8d4f056611a5fa50e1f5f68cf22475e94c4caef5e99a"
      },
      "check_exit": 0,
      "check_warnings": 0,
      "doc_exit": 0,
      "doc_warnings": 0,
      "doc_posture": "clean",
      "doctest_exit": 0,
      "doctests_passed": 0,
      "doctest_posture": "no_public_doctests",
      "examples_posture": "NoExampleSelected",
      "examples_exit": null,
      "features": [],
      "features_posture": "no_features",
      "no_default_check_exit": null,
      "role_marker": "Canonical policy loading",
      "limitation_marker": "without executing linked",
      "sibling_products_separate": true,
      "result": "complete",
      "limitations": []
    },
    {
      "name": "allow-inventory",
      "version": "0.2.0",
      "crate_sha256": "cc04dec8082df1bbff0a7b2b09ec23f89725b5edb926b8c7793833aafb41e0d5",
      "crate_size_bytes": 77997,
      "manifest_digest": "3e1dd3d822ef41a82d805c688cab970c6538e0066c555842a9fae2f890458528",
      "file_list_digest": "1efdb61f9a70a802d7845180350cf452003aeee9fe6e5f3408fbbd2e6a8cd370",
      "readme_present": true,
      "readme_sha256": "d1aca38ef4bd654a52985525dd8054659f2b6705dfc6e0e5ca6a5fffda404f5f",
      "license_assets_present": true,
      "external_repo_refs": [
        "docs/claim-boundaries.md"
      ],
      "reference_projection": {
        "published_version": "0.1.11",
        "candidate_version": "0.2.0",
        "channel_digest": "cb737ba63d2eed51113e8d4f056611a5fa50e1f5f68cf22475e94c4caef5e99a"
      },
      "check_exit": 0,
      "check_warnings": 0,
      "doc_exit": 0,
      "doc_warnings": 0,
      "doc_posture": "clean",
      "doctest_exit": 0,
      "doctests_passed": 0,
      "doctest_posture": "no_public_doctests",
      "examples_posture": "NoExampleSelected",
      "examples_exit": null,
      "features": [],
      "features_posture": "no_features",
      "no_default_check_exit": null,
      "role_marker": "Source-tree root discovery and file inventory",
      "limitation_marker": "does not call `cargo metadata`",
      "sibling_products_separate": true,
      "result": "complete",
      "limitations": []
    },
    {
      "name": "allow-files",
      "version": "0.2.0",
      "crate_sha256": "7a657fe1f6e1819668bd27fdae174a254ebc3cfc989b23f3673beb4376de9f75",
      "crate_size_bytes": 69592,
      "manifest_digest": "6e184064f768165bde06dc4459e82e710ee7678ca14df6405a06891c793d0ec7",
      "file_list_digest": "d0ba60ee62517d6f9ddc12c9c38228f732cde849563adfac7274766d180958ec",
      "readme_present": true,
      "readme_sha256": "ef77da5cd70dce1c0c46ba9031fe7a94919db0cfe41af56758b48492226e9766",
      "license_assets_present": true,
      "external_repo_refs": [
        "docs/claim-boundaries.md",
        "docs/how-to/run-changie-sensor.md"
      ],
      "reference_projection": {
        "published_version": "0.1.11",
        "candidate_version": "0.2.0",
        "channel_digest": "cb737ba63d2eed51113e8d4f056611a5fa50e1f5f68cf22475e94c4caef5e99a"
      },
      "check_exit": 0,
      "check_warnings": 0,
      "doc_exit": 0,
      "doc_warnings": 0,
      "doc_posture": "clean",
      "doctest_exit": 0,
      "doctests_passed": 0,
      "doctest_posture": "no_public_doctests",
      "examples_posture": "NoExampleSelected",
      "examples_exit": null,
      "features": [
        "changie"
      ],
      "features_posture": "documented_optional_changie",
      "no_default_check_exit": 0,
      "role_marker": "File-surface scanners",
      "limitation_marker": "rather than required build metadata",
      "sibling_products_separate": true,
      "result": "complete",
      "limitations": []
    },
    {
      "name": "allow-rust",
      "version": "0.2.0",
      "crate_sha256": "ada16e34bf272b32127f076f33602e1c3aa3b17fa31d8c74ce60b01e1888573e",
      "crate_size_bytes": 98089,
      "manifest_digest": "737a71edbfb1fb9066462eb66dbd15132aa3421b4158fc27c2a0847891290f97",
      "file_list_digest": "c2aa9420c4a3cc67331225da5d945ec6c423c8782793d0a41122a059249e445b",
      "readme_present": true,
      "readme_sha256": "a63935d1faa0141509513f9eca49273a1e7faddaaa3fd3a32a0df29ca8702dde",
      "license_assets_present": true,
      "external_repo_refs": [
        "docs/claim-boundaries.md"
      ],
      "reference_projection": {
        "published_version": "0.1.11",
        "candidate_version": "0.2.0",
        "channel_digest": "cb737ba63d2eed51113e8d4f056611a5fa50e1f5f68cf22475e94c4caef5e99a"
      },
      "check_exit": 0,
      "check_warnings": 0,
      "doc_exit": 0,
      "doc_warnings": 0,
      "doc_posture": "clean",
      "doctest_exit": 0,
      "doctests_passed": 2,
      "doctest_posture": "has_doctests",
      "examples_posture": "NoExampleSelected",
      "examples_exit": null,
      "features": [
        "default",
        "syntax"
      ],
      "features_posture": "default_features_only",
      "no_default_check_exit": null,
      "role_marker": "Source-syntax Rust scanners",
      "limitation_marker": "It parses source directly without invoking Cargo",
      "sibling_products_separate": true,
      "result": "complete",
      "limitations": []
    },
    {
      "name": "allow-match",
      "version": "0.2.0",
      "crate_sha256": "4a628c262d01248b23acabbefdb48fb3b71b15a09b3139e4161f3ff16d35fd00",
      "crate_size_bytes": 38845,
      "manifest_digest": "ee64ef99c48c9d6e410c6692ade170637b662d2cb8d2da97dbbe5e2dc495f2a4",
      "file_list_digest": "f0c226cbcdc3b12f26b3639ab454d4088e5e208d0327a3aff36c5e75d23d2431",
      "readme_present": true,
      "readme_sha256": "614f54c6d2541fb2bc10dc8b9256c73761455c17c3aa89c7a28f00e7cabb835b",
      "license_assets_present": true,
      "external_repo_refs": [
        "docs/claim-boundaries.md"
      ],
      "reference_projection": {
        "published_version": "0.1.11",
        "candidate_version": "0.2.0",
        "channel_digest": "cb737ba63d2eed51113e8d4f056611a5fa50e1f5f68cf22475e94c4caef5e99a"
      },
      "check_exit": 0,
      "check_warnings": 0,
      "doc_exit": 0,
      "doc_warnings": 0,
      "doc_posture": "clean",
      "doctest_exit": 0,
      "doctests_passed": 0,
      "doctest_posture": "no_public_doctests",
      "examples_posture": "NoExampleSelected",
      "examples_exit": null,
      "features": [],
      "features_posture": "no_features",
      "no_default_check_exit": null,
      "role_marker": "Structural finding-to-policy matching",
      "limitation_marker": "It only reasons over source-syntax findings",
      "sibling_products_separate": true,
      "result": "complete",
      "limitations": []
    },
    {
      "name": "allow-report",
      "version": "0.2.0",
      "crate_sha256": "d695fb6e59f542067612c537eca68c5f0074bf9b612f543fb03e9ea2b3100da3",
      "crate_size_bytes": 474775,
      "manifest_digest": "039f940a15d46cfd502a73107a648764d9bbeeb19223d753e5fcd04ad8d44365",
      "file_list_digest": "d1357ba90c16bc21d404cdda6b8c0c4213b0654a3183d40688f4702f4f0c885b",
      "readme_present": true,
      "readme_sha256": "97c024c667fdddcf80b75e18aed344fd50fd871f19f1752642a14cf070ca2eb1",
      "license_assets_present": true,
      "external_repo_refs": [
        "docs/claim-boundaries.md"
      ],
      "reference_projection": {
        "published_version": "0.1.11",
        "candidate_version": "0.2.0",